409,410,411, a document that tell us to provide the guidelines on how to write the Python code is PEP8,PEP 8: a set of rules to format and degrades codes readability.,0
410,411,412,A dictionary consists of a collection of key-value pairs. Each key-value pair maps the key to its associated value," A Python dictionary is a mapping of similar keys to values. Dictionaries are mutable, which means they can be changed",0
411,412,413,Python inheritance means creating a new class that inherits all functionalities from parent class & allows to add more,Python inheritance means creating a new class that inherits all functionalities from any class & allows to add more,0
412,413,414,Encapsulation is the packing of data and functions operating on that data into a single component and restricting the access to some of the object's components,Encapsulation is the packing of data and functions operating on that data into a double component and allowing the access to some of the object's components,0
413,414,415,pickling :used to convert python object  into a binary stream ,The Python pickle is defined as a module which accepts any Python object and converts it into a string representation.,1
414,415,416,PIP is a package manager for installing  Python packages,Pip is a python package management system which can also be used to uninstall various software written in python,0
415,416,417, Set can be defined as the unordered collection of various items ,SET is unordered collections of unique elements,0
416,417,418," A Python dictionary is a mapping of unique keys to values. Dictionaries are mutable, which means they can be changed"," A Python dictionary is a mapping of similar keys to values. Dictionaries are mutable, which means they can be changed",0
417,418,419,the tuples cannot be changed ,the tuples are mutable,0
418,419,420,"Python is a widely used general-purpose, dynamic, extensible, high-level programming language","Python is an interpreted, high-level, general-purpose programming language",1
419,420,421,Django is a web framework built with the java programming language,"Django is a low-level java Web framework that encourages rapid development and clean, pragmatic design",0
